{
    "features":[
        {
            "Data Rate":"0.0166666666667",
            "HOR":"101",
            "Required Asset Management Location Code":"CFGLOC101669",
            "Required Asset Management Location ID":            2994,
            "TMI":"000",
            "VER":"100",
            "geometry":null,
            "properties":{
                "context":[
                    "surfacewater"
                ],
                "domain":"D10",
                "install_date":"2022-03-02T00:00:00Z",
                "locations":{
                    "features":[
                        {
                            "geometry":{
                                "coordinates":[
                                                                        -102.450048,
                                                                        39.758552,
                                                                        1179.579
                                ],
                                "type":"Point"
                            },
                            "properties":{
                                "alpha":                                0,
                                "beta":                                0,
                                "end_date":"2022-03-03T00:00:00Z",
                                "gamma":                                0,
                                "location_properties":[
                                    [
                                        "Country",
                                        "USA"
                                    ],
                                    [
                                        "County",
                                        "Yuma"
                                    ],
                                    [
                                        "State province",
                                        "CO"
                                    ],
                                    [
                                        "Coordinate uncertainty",
                                                                                0.231
                                    ],
                                    [
                                        "Real world coordinate uncertainty",
                                                                                0.1
                                    ],
                                    [
                                        "Real world elevation uncertainty",
                                                                                0.1
                                    ],
                                    [
                                        "Survey vertical uncertainty",
                                                                                0.002
                                    ],
                                    [
                                        "Elevation uncertainty",
                                                                                0.1
                                    ],
                                    [
                                        "Survey horizontal uncertainty",
                                                                                0.018
                                    ],
                                    [
                                        "Transformation RMSE",
                                                                                0.131
                                    ],
                                    [
                                        "Coordinate source",
                                        "AIS_SURVEY"
                                    ],
                                    [
                                        "UTM Zone",
                                        "13N"
                                    ],
                                    [
                                        "Geodetic datum",
                                        "WGS84"
                                    ]
                                ],
                                "reference_location":null,
                                "start_date":"2022-03-02T00:00:00Z",
                                "x_offset":                                0.036,
                                "y_offset":                                0,
                                "z_offset":                                -0.343
                            },
                            "type":"Feature"
                        }
                    ],
                    "type":"FeatureCollection"
                },
                "name":"CFGLOC101669",
                "remove_date":"2022-03-03T00:00:00Z",
                "site":"ARIK"
            },
            "type":"Feature"
        }
    ],
    "source_id":    43697,
    "source_type":"leveltroll500",
    "type":"FeatureCollection"
}
