{
  "type": "FeatureCollection",
  "features": [
    {
      "type": "Feature",
      "geometry": null,
      "properties": {
        "name": "CFGLOC101663",
        "site": "POSE",
        "install_date": "2019-09-04T15:10:48Z",
        "remove_date": null,
        "transaction_date": "2019-09-04T15:10:53Z",
        "context": [
          "surfacewater",
          "water-quality-237",
          "water-quality"
        ],
        "locations": {
          "type": "FeatureCollection",
          "features": [
            {
              "type": "Feature",
              "geometry": {
                "type": "Point",
                "coordinates": [
                  -78.147286,
                  38.894397,
                  275.79
                ]
              },
              "properties": {
                "start_date": "2010-01-01T00:00:00Z",
                "end_date": null,
                "transaction_date": "2016-02-17T18:05:39Z",
                "alpha": 0,
                "beta": 0,
                "gamma": 0,
                "x_offset": 0.06731,
                "y_offset": 0.12,
                "z_offset": 0.06,
                "reference_location": {
                  "type": "Feature",
                  "geometry": null,
                  "properties": {
                    "name": "S1LOC101258",
                    "locations": null
                  }
                }
              }
            }
          ]
        }
      },
      "Required Asset Management Location ID": 2988,
      "Required Asset Management Location Code": "CFGLOC101663",
      "HOR": "101",
      "VER": "100",
      "TMI": "000",
      "Data Rate": "1"
    }
  ],
  "source_type": "prt",
  "source_id": 16247
}
